{
  "$schema": "http://json-schema.org/draft-07/schema#",
  "$id": "asdd/workspace.schema.json",
  "title": "ASDD Workspace — contrato del repo de desarrollo (WS-001)",
  "description": "Declara donde vive el codigo que ASDD implementa. ASDD es un repo de configuracion; el codigo puede vivir en el mismo repo (modo mono-repo legado) o en uno o varios repos git independientes. El resolver .claude/scripts/asdd-resolve-workspace.mjs es la unica fuente de verdad en runtime — orquestador, developers y gates consumen su salida, nunca este archivo directamente. Los overrides por maquina van en .asdd/workspace.local.json (gitignored), que gana clave por clave.",
  "type": "object",
  "required": ["schema", "default_project", "projects"],
  "additionalProperties": false,
  "properties": {
    "$comment": {
      "type": "string",
      "description": "Guia para humanos. JSON no admite comentarios; esta clave cumple ese rol. El runtime la ignora."
    },
    "schema": {
      "const": "1.0",
      "description": "Version del contrato de workspace."
    },
    "default_project": {
      "type": "string",
      "pattern": "^[a-z0-9]+(?:-[a-z0-9]+)*$",
      "description": "Clave de projects usada cuando .asdd-run.json no declara 'project' y no se pasa --project."
    },
    "projects": {
      "type": "object",
      "minProperties": 1,
      "description": "Mapa de repos de desarrollo. Una clave por proyecto en kebab-case.",
      "propertyNames": { "pattern": "^[a-z0-9]+(?:-[a-z0-9]+)*$" },
      "additionalProperties": { "$ref": "#/definitions/project" }
    }
  },
  "definitions": {
    "project": {
      "type": "object",
      "required": ["root"],
      "additionalProperties": false,
      "properties": {
        "root": {
          "type": "string",
          "minLength": 1,
          "description": "Raiz del repo de desarrollo. Relativa a la raiz del ASDD (ej. 'proyectos/mi-proyecto') o absoluta (ej. 'D:/repos/ms-bank', '/srv/repos/ms-bank') para un repo ya clonado fuera del ASDD. '.' activa el modo mono-repo legado: el codigo vive en el repo ASDD. El resolver exige que sea un repo git con al menos un commit. Si queda fuera de la raiz del ASDD, el resolver registra la ruta en permissions.additionalDirectories de .claude/settings.local.json."
        },
        "base_branch": {
          "type": ["string", "null"],
          "description": "Rama del repo de desarrollo desde la cual se crean las ramas de trabajo y a la cual se mergea (ORC-011-D). Suele ser el integration branch del proyecto: develop, dev, main. Vacio o null → el resolver usa la rama actual del project root y lo reporta explicitamente en su salida."
        },
        "branch_pattern": {
          "type": "string",
          "minLength": 1,
          "description": "Patron de la rama de trabajo que el worktree crea. Placeholders: {ticket}, {slug}, {area}, {run_id}. El prefijo debe estar en ASDD_GITFLOW_PREFIXES (GS-004). Si el patron no contiene {area} ni {run_id} no puede discriminar developers concurrentes: el resolver devuelve parallel_safe=false y ORC-011-A degrada a lotes secuenciales. Default si se omite: 'feature/{slug}-{area}'."
        },
        "description": {
          "type": "string",
          "description": "Nota libre para humanos. El runtime la ignora."
        }
      }
    }
  }
}
